{
  "$schema": "https://json-schema.org/draft/2020-12/schema",
  "type": "object",
  "properties": {
    "schemaVersion": {
      "type": "string",
      "minLength": 1
    },
    "modelVersion": {
      "type": "string",
      "minLength": 1
    },
    "sell": {
      "type": "object",
      "properties": {
        "initial": {
          "type": "string",
          "const": "SELL_IDLE"
        },
        "states": {
          "type": "array",
          "items": {
            "type": "string",
            "enum": [
              "SELL_IDLE",
              "NEWS_ARMED",
              "MARKET_ARMED",
              "SELL_PRETRIGGER",
              "SELL_CONFIRMED",
              "SELL_COOLDOWN",
              "REBUY_WAIT",
              "DATA_BLOCKED"
            ]
          }
        },
        "transitions": {
          "type": "array",
          "items": {
            "type": "object",
            "properties": {
              "from": {
                "type": "string",
                "enum": [
                  "SELL_IDLE",
                  "NEWS_ARMED",
                  "MARKET_ARMED",
                  "SELL_PRETRIGGER",
                  "SELL_CONFIRMED",
                  "SELL_COOLDOWN",
                  "REBUY_WAIT",
                  "DATA_BLOCKED"
                ]
              },
              "to": {
                "type": "string",
                "enum": [
                  "SELL_IDLE",
                  "NEWS_ARMED",
                  "MARKET_ARMED",
                  "SELL_PRETRIGGER",
                  "SELL_CONFIRMED",
                  "SELL_COOLDOWN",
                  "REBUY_WAIT",
                  "DATA_BLOCKED"
                ]
              },
              "guard": {
                "type": "string",
                "minLength": 1
              }
            },
            "required": [
              "from",
              "to",
              "guard"
            ],
            "additionalProperties": false
          }
        },
        "globalTransitions": {
          "type": "array",
          "items": {
            "type": "object",
            "properties": {
              "from": {
                "type": "string",
                "const": "*"
              },
              "to": {
                "type": "string",
                "enum": [
                  "SELL_IDLE",
                  "NEWS_ARMED",
                  "MARKET_ARMED",
                  "SELL_PRETRIGGER",
                  "SELL_CONFIRMED",
                  "SELL_COOLDOWN",
                  "REBUY_WAIT",
                  "DATA_BLOCKED"
                ]
              },
              "guard": {
                "type": "string",
                "minLength": 1
              }
            },
            "required": [
              "from",
              "to",
              "guard"
            ],
            "additionalProperties": false
          }
        },
        "requiredConditionDenominator": {
          "type": "integer",
          "exclusiveMinimum": 0,
          "maximum": 9007199254740991
        },
        "hardGates": {
          "type": "array",
          "items": {
            "type": "string",
            "minLength": 1
          }
        },
        "validationMaximumAction": {
          "type": "string",
          "const": "SHADOW_CANDIDATE"
        }
      },
      "required": [
        "initial",
        "states",
        "transitions",
        "globalTransitions",
        "requiredConditionDenominator",
        "hardGates",
        "validationMaximumAction"
      ],
      "additionalProperties": false
    },
    "rebuy": {
      "type": "object",
      "properties": {
        "initial": {
          "type": "string",
          "const": "REBUY_INACTIVE"
        },
        "states": {
          "type": "array",
          "items": {
            "type": "string",
            "enum": [
              "REBUY_INACTIVE",
              "REBUY_WAIT",
              "REBUY_ARMED",
              "REBUY_TRANCHE_1",
              "REBUY_TRANCHE_2_WAIT",
              "REBUY_COMPLETE",
              "REBUY_VETOED"
            ]
          }
        },
        "transitions": {
          "type": "array",
          "items": {
            "type": "object",
            "properties": {
              "from": {
                "type": "string",
                "enum": [
                  "REBUY_INACTIVE",
                  "REBUY_WAIT",
                  "REBUY_ARMED",
                  "REBUY_TRANCHE_1",
                  "REBUY_TRANCHE_2_WAIT",
                  "REBUY_COMPLETE",
                  "REBUY_VETOED"
                ]
              },
              "to": {
                "type": "string",
                "enum": [
                  "REBUY_INACTIVE",
                  "REBUY_WAIT",
                  "REBUY_ARMED",
                  "REBUY_TRANCHE_1",
                  "REBUY_TRANCHE_2_WAIT",
                  "REBUY_COMPLETE",
                  "REBUY_VETOED"
                ]
              },
              "guard": {
                "type": "string",
                "minLength": 1
              }
            },
            "required": [
              "from",
              "to",
              "guard"
            ],
            "additionalProperties": false
          }
        },
        "globalTransitions": {
          "type": "array",
          "items": {
            "type": "object",
            "properties": {
              "from": {
                "type": "string",
                "const": "*"
              },
              "to": {
                "type": "string",
                "enum": [
                  "REBUY_INACTIVE",
                  "REBUY_WAIT",
                  "REBUY_ARMED",
                  "REBUY_TRANCHE_1",
                  "REBUY_TRANCHE_2_WAIT",
                  "REBUY_COMPLETE",
                  "REBUY_VETOED"
                ]
              },
              "guard": {
                "type": "string",
                "minLength": 1
              }
            },
            "required": [
              "from",
              "to",
              "guard"
            ],
            "additionalProperties": false
          }
        },
        "requiredConditionDenominator": {
          "type": "integer",
          "exclusiveMinimum": 0,
          "maximum": 9007199254740991
        },
        "hardGates": {
          "type": "array",
          "items": {
            "type": "string",
            "minLength": 1
          }
        },
        "validationMaximumAction": {
          "type": "string",
          "const": "SHADOW_CANDIDATE"
        }
      },
      "required": [
        "initial",
        "states",
        "transitions",
        "globalTransitions",
        "requiredConditionDenominator",
        "hardGates",
        "validationMaximumAction"
      ],
      "additionalProperties": false
    },
    "chainActionStates": {
      "type": "array",
      "items": {
        "type": "string",
        "enum": [
          "SIGNAL_NOT_READY",
          "QUOTE_PENDING",
          "ACTIONABLE_WITH_EVIDENCE",
          "SHADOW_CANDIDATE",
          "BLOCKED_DATA",
          "BLOCKED_IDENTITY",
          "BLOCKED_COST",
          "BLOCKED_LIQUIDITY",
          "UNSUPPORTED",
          "UNKNOWN"
        ]
      }
    },
    "noActionIsFormalOutput": {
      "type": "boolean",
      "const": true
    }
  },
  "required": [
    "schemaVersion",
    "modelVersion",
    "sell",
    "rebuy",
    "chainActionStates",
    "noActionIsFormalOutput"
  ],
  "additionalProperties": false,
  "$id": "https://virtual-risk.local/schema/legacy-v0.2-state-machine-spec.v1.json"
}
